{
  "schema_version": "1.0.0",
  "repository": "egohygiene/example-library",
  "repository_class": "library",
  "security_level": "baseline",
  "pins": {
    "architecture": "egohygiene/hygiene@architecture-v0.1.0",
    "adr_policy": "egohygiene/hygiene@a05b14f8b9e2772124f879f818e09a911e996ad8",
    "foundation": "egohygiene/holon@foundation-v0.1.0",
    "aether": "egohygiene/aether@v0.1.0"
  },
  "capabilities": { "include": [], "exclude": [] },
  "sites": [],
  "preserve_paths": ["README.md"],
  "parameters": { "language": "rust" }
}
